### DISCUSSION TITLE
SRT listener on dual-WAN server replies via wrong interface, breaking handshake

### DISCUSSION THREAD

**Discussion by yurbas-yur** [Haivision/srt#3252] [General]
**Issue 1:** Basic SRT Listener - Wrong Source IP in Replies
Command:
```
srt-live-transmit 'udp://224.2.2.2:2222' 'srt://:30888?mode=listener'
```

**Expected Behavior:**
- Client connects to `srt://listener_ip1:30888` → replies from `listener_ip1` via WAN1 ✅
- Client connects to `srt://listener_ip2:30888` → replies from `listener_ip2` via WAN2 ✅

**Actual Behavior:**
- Client connects to `srt://listener_ip1:30888` → works correctly ✅
- Client connects to `srt://listener_ip2:30888` → **replies from `listener_ip1` via WAN1** ❌

**tcpdump evidence:**
```
12:31:33.588908 IP caller_ip.56071 > listener_ip2.30888: UDP, length 64  (incoming to WAN2)
12:31:33.589014 IP listener_ip1.30888 > caller_ip.56071: UDP, length 64  (reply from WAN1 - WRONG!)
```

The server creates a **new outgoing connection** from `listener_ip1` instead of replying on the same socket that received the request on `listener_ip2`. Client rejects the reply because source IP doesn't match, causing handshake timeout.

**Server logs show:**
```
12:31:33.589017 Listener got the connection request from: caller_ip:56071 result:waveahand
```
Repeated "waveahand" messages indicate the server keeps sending handshake replies, but client never receives them (or rejects them due to source IP mismatch).

Binding to interfaces working as expected without any issue
```
srt-live-transmit 'udp://224.2.2.2:2222' 'srt://listener_ip2:30888?mode=listener'
```
without additional routing.


**Issue 2:** Connection Groups (Active-Active Bonding) - Only WAN1 Connects
Command:
```
srt-live-transmit 'udp://224.2.2.106:2216' 'srt://:5088?groupconnect=1&pkt_size=1316&latency=2000&mode=listener'
```

**Expected Behavior:**
Both connections added to the group:
- Caller connects via WAN1 → connection established and added to group ✅
- Caller connects via WAN2 → connection established and added to group ✅

**Actual Behavior:**
- WAN1 connection: Established successfully and added to group ✅
- WAN2 connection: **Handshake fails** (same wrong-source-IP issue) ❌

**Server logs:**
```
12:31:33.589017 Listener got the connection request from: caller_ip2:56071 result:waveahand
12:31:33.656731 Listener got the connection request from: caller_ip1:59330 result:waveahand
12:31:34.038343 connection on listener @892341783 (listener_ip1:5088) from peer (caller_ip1:59330)
```
Only the WAN1 connection progresses beyond "waveahand" to actual connection establishment.

**Issue 3:** srt-test-live (similar behavior)

Command:
```
srt-test-live 'udp://224.2.2.106:2216' 'srt://:5088?groupconnect=1&latency=2000'
```

Actual: WAN1 connects; WAN2 keeps sending requests.
Only If we add an explicit host route for the caller via WAN2:
```
sudo ip route add caller_ip2 via listener_ip2_gw dev enp3s0f0np0 src listener_ip2
```

…then srt-test-live succeeds for WAN2 and we can see active traffic on both WAN1 and WAN2 interfaces
```
interface: eno1
bps
filter: port 5088
   bps    % desc                                                                                                                                                                                                                                                                    
  4.4M  99% udp caller_ip1:59330 <-> listener_ip1:5088

interface: enp3s0f0np0
bps
filter: port 5088
   bps    % desc                                                                                                                                                                                                                                                                    
  4.4M  98% udp caller_ip2:56071 <-> listener_ip2:5088
```
**Questions**
1. What's the best way to configure srt-live-transmit or server so it responds from the receiving interface when bound to 0.0.0.0:PORT?
2. Does srt-live-transmit support groupconnect active-active when the listener is bound to 0.0.0.0:PORT on a multi-wan server? Any extra options required?
3. How can I get srt-test-live in active-active mode to respond from the receiving interface without additional caller's IPs routing?

**Comment by ethouris** [comment]
Have you compiled the code with `ENABLE_PKTINFO`?

This is not enabled by default because it's not supported for every platform. On FreeBSD it doesn't work and on Windows it's just not implemented. But it does work on Linux.

There shouldn't be any problem with having a single listener with omni-binding to listen on effectively multiple devices, as long as the IP addresses assigned to the devices don't share the common broadcast IP (IP & ~mask value is not the same for both IP addresses). At least I've always been testing on a device with 4 different NICs and an omni-bound listener; the connection was always established over the link from which the caller was reporting.

We have only detected one case when the listener responds over the wrong link - see docs/build/build-options.md under ENABLE_PKTINFO.

We have never seen this behavior in any case other than the shared broadcast prefix - but might be that you have something in the routing rules that causes that behavior. Note that the OS's firewalls normally are unaware of SRT and treat its packets as UDP, effectively stating that it doesn't really matter over which link the UDP is sent, or resolve the routing some default way, if the source address in UDP is set by the machine itself. The listener bound to "any" (0.0.0.0) will decide this source address by itself, and this may cause setting the wrong address from the SRT perspective. This PKTINFO feature allows SRT to forcefully set this source IP address and not rely on the listener's machine.

**Reply by yurbas-yur** [reply]
Thanks a lot, PKTINFO resolved 0.0.0.0 binding Issue in a standalone mode, but srt-live-transmit still doesn't work in the active-active mode.
After rebuilding with --enable-pktinfo:
```
./configure --enable-bonding --enable-pktinfo --enable-testing
```
The listener now correctly responds via both WAN interfaces in a standalone mode.

However, only one caller is being added to the group when running srt-live-transmit with groupconnect=1.
```
srt-live-transmit -r 2000 -ll debug  'udp://224.2.2.106:2216'  'srt://:5088?groupconnect=1&latency=2000&pkt_size=1316'
Multicast: home address: INADDR_ANY:2216
UDP:Multicast(POSIX): will bind to: 224.2.2.106:2216
SRT parameters specified:
        groupconnect = '1'
        latency = '2000'
        mode = 'listener'
        pkt_size = '1316'

Opening SRT target listener on :5088
12:31:01.971161/srt-live-transm D:SRT.sm: generateSocketID: : @140766016
Binding a server on :5088 ...
12:31:01.971212/srt-live-transm D:SRT.km: CHANNEL: Bound to local address: 0.0.0.0:5088
 listen...

12:31:02.013407/SRT:RcvQ:w1 D:SRT.cn: PASSING request from: CALLER_IP1:57152 to listener:140766016
12:31:02.013481/SRT:RcvQ:w1 D:SRT.cn: Listener got the connection request from: CALLER_IP1:57152 result:waveahand

12:31:02.224571/SRT:RcvQ:w1 D:SRT.cn: PASSING request from: CALLER_IP2:41287 to listener:140766016
12:31:02.224604/SRT:RcvQ:w1 D:SRT.cn: Listener got the connection request from: CALLER_IP2:41287 result:waveahand

12:31:02.269377/SRT:RcvQ:w1 D:SRT.cn: PASSING request from: CALLER_IP1:57152 to listener:140766016
12:31:02.269404/SRT:RcvQ:w1 D:SRT.cn: Listener got the connection request from: CALLER_IP1:57152 result:waveahand

12:31:02.364642/SRT:RcvQ:w1 D:SRT.cn: PASSING request from: CALLER_IP1:57152 to listener:140766016
12:31:02.364680/SRT:RcvQ:w1 D:SRT.sm: generateSocketID: : @140766015
12:31:02.364688/SRT:RcvQ:w1 D:SRT.cn: HSREQ/rcv: cmd=1(HSREQ) len=12 vers=0x10504 opts=0xbf delay=120
12:31:02.364694/SRT:RcvQ:w1 D:SRT.sm: generateSocketID: (group): @1214507838
12:31:02.364712/SRT:RcvQ:w1.N:SRT.gm: group/add: adding member @140766015 into group $1214507838
12:31:02.365057/SRT:RcvQ:w1.N:SRT.cn: @140766015 connection on listener @140766016 (LISTENER_IP1:5088) from peer @146733766 (CALLER_IP1:57152)
12:31:02.365073/SRT:RcvQ:w1 D:SRT.cn: @140766016: listen ret: -1 - conclusion
 accept... 
12:31:02.365083/SRT:RcvQ:w1 D:SRT.cn: Listener got the connection request from: CALLER_IP1:57152 result:waveahand
 connected.
12:31:02.365162/srt-live-transm*E:SRT.ea: remove_usock: @140766016 not found as either socket or group. Removing only from epoll system.
Accepted SRT target connection
12:31:03.365223/SRT:GC.N:SRT.sm: @140766016 busy=0
12:31:03.365240/SRT:GC*E:SRT.ei: epoll/update: IPE: update struck E1 which is NOT SUBSCRIBED to @140766016
12:31:03.365245/SRT:GC*E:SRT.ei: epoll/update: IPE: update struck E1 which is NOT SUBSCRIBED to @140766016
192136 bytes lost, 1827924 bytes sent, 2020060 bytes received
+++/+++SRT BANDWIDTH: 0
```
tcpdump
```
12:31:01.456593 IP CALLER_IP2.41287 > LISTENER_IP2.5088: UDP, length 64
12:31:01.501632 IP CALLER_IP1.57152 > LISTENER_IP1.5088: UDP, length 64
12:31:01.712520 IP CALLER_IP2.41287 > LISTENER_IP2.5088: UDP, length 64
12:31:01.759239 IP CALLER_IP1.57152 > LISTENER_IP1.5088: UDP, length 64
12:31:01.968568 IP CALLER_IP2.41287 > LISTENER_IP2.5088: UDP, length 64
12:31:02.013362 IP CALLER_IP1.57152 > LISTENER_IP1.5088: UDP, length 64
12:31:02.013478 IP LISTENER_IP1.5088 > CALLER_IP1.57152: UDP, length 64
12:31:02.224555 IP CALLER_IP2.41287 > LISTENER_IP2.5088: UDP, length 64
12:31:02.224601 IP LISTENER_IP2.5088 > CALLER_IP2.41287: UDP, length 64
12:31:02.269334 IP CALLER_IP1.57152 > LISTENER_IP1.5088: UDP, length 64
12:31:02.269401 IP LISTENER_IP1.5088 > CALLER_IP1.57152: UDP, length 64
12:31:02.364598 IP CALLER_IP1.57152 > LISTENER_IP1.5088: UDP, length 92
12:31:02.365052 IP LISTENER_IP1.5088 > CALLER_IP1.57152: UDP, length 92
12:31:02.365240 IP LISTENER_IP1.5088 > CALLER_IP1.57152: UDP, length 1332
12:31:02.385521 IP LISTENER_IP1.5088 > CALLER_IP1.57152: UDP, length 1332
...
12:31:03.811148 IP CALLER_IP1.57152 > LISTENER_IP1.5088: UDP, length 44
12:31:03.811201 IP LISTENER_IP1.5088 > CALLER_IP1.57152: UDP, length 20
12:31:03.811288 IP LISTENER_IP1.5088 > CALLER_IP1.57152: UDP, length 1332
...
```
Network Configuration
```
ip route
default via LISTENER_GW1 dev eno1 proto static metric 100 
default via LISTENER_GW2 dev enp3s0f0np0 proto static metric 200 
LISTENER_NET2/28 dev enp3s0f0np0 proto kernel scope link src LISTENER_IP2
LISTENER_NET1/28 dev eno1 proto kernel scope link src LISTENER_IP1
192.168.7.0/24 dev eno2 proto kernel scope link src 192.168.7.59 
224.0.0.0/4 dev eno2 proto static scope link 

ip route show table 100
default via LISTENER_GW1 dev eno1 proto static 

ip route show table 200
default via LISTENER_GW2 dev enp3s0f0np0 proto static 

ip rule
0:	from all lookup local
0:	from LISTENER_IP2 lookup 200
0:	from LISTENER_IP1 lookup 100
32766:	from all lookup main
32767:	from all lookup default
```
So listener responds via correct interfaces, and both callers reach listener successfully.
But Only CALLER_IP1:57152 is added to group $1214507838
CALLER_IP2:41287 never progresses past initial handshake

Should srt-live-transmit support active-active mode?
srt-test-live working properly on the same server in the active-active mode without additional routing or network configuration.
Server OS Ubuntu 20.04, SRT Library version: 1.5.5

**Reply by ethouris** [reply]
srt-live-transmit doesn't support bonding at all. The only tool for testing it is `srt-test-live` (needs to be enabled at compile time by ENABLE_TESTING). This tool works also a bit differently (it's more a developer testing tool), but it does support bonding.

**Reply by yurbas-yur** [reply]
Thank you, noted. One more question: Is there a way to keep srt-test-live running after the caller disconnects? Currently, the app closes as soon as the SRT caller disconnects:
```
[., ... , 1316  ->  (#2925 %1782921351  7625EA68) .] sent
[., ... , 1316  ->  FAILURE
srt_sendmsg: [2001.0] Connection was broken
STD EXCEPTION: error: srt_sendmsg: Connection was broken
Waiting 5s for possible cleanup...
12:46:25.079015/SRT:GC.N:SRT.sm: @986322174 busy=0
SrtCommon: DESTROYING CONNECTION, closing socket (rt%986322174)...
SrtCommon: DESTROYING SERVER, closing socket (ls%986322175)...
SrtCommon: ... done.
12:46:28.874854/srt-test-live.N:SRT.sm: @986322175 busy=0
```
